,title,subtitles,links
0,FURIOUS GOONERS,Arsenal fans say 'game is rigged' as Kovacic avoids red after VAR check,https://www.thesun.co.uk/sport/24329740/arsenal-man-city-mateokovacic-red-card/
1,UGLY SCENES,Haaland and Walker caught up in furious clash with Arsenal backroom staff,https://www.thesun.co.uk/sport/24330436/erling-haaland-kyle-walker-arsenal-manchester-city/
2,WIL HE WONT HE,Arsenal suffer injury blow as William Saliba withdraws from France squad,https://www.thesun.co.uk/sport/24330824/arsenal-william-saliba-injury-man-city-france/
3,GUN OFF,Arsenal fan THROWN OUT of Emirates for 'squaring up' to former Gunners star,https://www.thesun.co.uk/sport/24329932/arsenal-fan-thrown-out-emirates-squaring-nasri/
4,ARSENAL PLAYER RATINGS,Saliba doesn't allow Erling Haaland a touch but Trossard struggles,https://www.thesun.co.uk/sport/24330113/arsenal-player-ratings-saliba-erling-haaland-trossard-martinelli/
5,WEST HAM 2 NEWCASTLE 2,Mohammed Kudus bags first Premier League goal late on,https://www.thesun.co.uk/sport/24298216/west-ham-vs-newcastle-live-score-latest-premier-league-updates/
6,GREEN LIGHT,Mason Greenwood SCORES first goal in 628 days for Getafe,https://www.thesun.co.uk/sport/24330116/mason-greenwood-goal-getafe/
7,NEW LOOK,Fans divided by huge Sky Sports change for Arsenal vs Man City with some 'seasick',https://www.thesun.co.uk/sport/24329743/arsenal-man-city-game-mode-camera-sky-sports-reaction/
8,RAY OF LIGHT,Former Arsenal star says Ramsdale is 'dancing on the bench' after Raya clanger,https://www.thesun.co.uk/sport/24329967/theo-walcott-david-raya-aaron-ramsdale/
9,LO AND BEHOLD,Former Chelsea star RETIRES from football at 36 after incredible career,https://www.thesun.co.uk/sport/24329438/chelsea-loic-remy-retires-newcastle-crystal-palace-qpr/
10,,Sky Sports commit shock blunder as they announce Bowen signs new MAN UTD deal,https://www.thesun.co.uk/sport/24328560/sky-sports-jarrod-bowen-manchester-united-west-ham/
11,THAT'S ZLAT,Zlatan Ibrahimovic reveals what Wenger said to make Arsenal transfer collapse,https://www.thesun.co.uk/sport/24329472/zlatan-ibrahimovic-wenger-arsenal-no9-piers-morgan/
12,'GOLD',Spanish club releases goal celebration clip with playing simulating rude sex act,https://www.thesun.co.uk/sport/24329542/football-news-cd-guadalajara-goal-video-sex-act/
13,DERBY DAY,Diletta Leotta puts on leggy display with stunning look to present huge derby,https://www.thesun.co.uk/sport/24328906/tv-host-diletta-leotta-juventus-torino/
14,CAUGHT OUT,Watch Alisson 'pay tribute to Onana' with 'embarrassing' howler at Brighton,https://www.thesun.co.uk/sport/24328742/alisson-liverpool-mistake-simon-adingra/
15,HE'S A KEEPER,AC Milan make hilarious change to squad list after Giroud's incredible cameo,https://www.thesun.co.uk/sport/24328887/ac-milan-arsenal-chelsea-olivier-giroud-genoa/
16,WOLVES 1 VILLA 1,Pau Torres scores first goal seconds after Hwang opener as rivals draw,https://www.thesun.co.uk/sport/24298310/wolves-vs-aston-villa-live-score-latest-premier-league-updates/
17,,Fury over Celtic fans pro-Palestinian banners after Hamas kill 200 Israelis,https://www.thesun.co.uk/sport/24327109/celtic-ultras-palestinian-banners-israeli-conflict/
18,LIFE'S A PITCH,I live next to a world famous football stadium… match days are a nightmare,https://www.thesun.co.uk/sport/24328777/live-world-famous-stadium-parking-newcastle/
19,TAKING COVER,Footie stars Keane and Delap flee Israel after hiding in panic room for hours,https://www.thesun.co.uk/sport/24327480/israel-hamas-robbie-keane-maccabi-tel-aviv/
20,KRIS CROSS,Man Utd fans mock Brentford star after spotting him celebrating before comeback,https://www.thesun.co.uk/sport/24327670/man-utd-fans-brentford-clown-celebrating-goal-kick-ajer/
21,,Watch England hero get sent off for timewasting in FIRST HALF as fans blast ref,https://www.thesun.co.uk/sport/24328403/watch-england-hero-sent-off-timewasting-fans-greenwood/
22,WHAT A RESULT,Need your footie news INSTANTLY? Join our Sports WhatsApp channel in 3 steps,https://www.thesun.co.uk/sport/24260972/how-join-suns-sports-whatsapp-channel/
23,WELCOME OFFER,Get £30 in free bets for the football this weekend with talkSPORT BET,https://www.thesun.co.uk/sport/football/dream-team/23304459/talksportbet-free-bets-new-customers-betting-offer/
24,POWER UP,Get £40 in free Bet Builder bets when you stake £10 on football with Paddy Power,https://www.thesun.co.uk/sport/football/19782139/paddy-power-free-bets-football/
25,WELCOME OFFER,Get a £50 bonus when you spend £10 on Sun Vegas,https://www.thesun.co.uk/sun-bingo/23376227/welcome-offer-sun-vegas-bonus/
26,WRIGHT ON,Glamorous footballer Madelene Wright strips down and bares bum in cheeky selfie,https://www.thesun.co.uk/sport/24328478/madelene-wright-onlyfans-instagram-leyton-orient/
27,ON FORM,Watch ace Man Utd let leave net solo goal as Lindelof 'becomes 200th left back',https://www.thesun.co.uk/sport/24329150/man-utd-brandon-williams-goal-ipswich-victor-lindelof/
28,ROO ROLE?,Wayne Rooney's son Kai drops major hint over ex-Man Utd star's next job,https://www.thesun.co.uk/sport/24328937/wayne-rooneys-son-kai-managerial-birmingham-city/
29,CROWD PLEASER,Brighton fans troll Liverpool with four-word chant following VAR shambles,https://www.thesun.co.uk/sport/24329174/brighton-fans-liverpool-var/
30,ROL UP,Win an incredible Rolex or £12k in cash from just 53p with our discount code,https://www.thesun.co.uk/sport/18922011/win-rolex-7dp/
31,GREAT SCOTT,Alex Scott fans love BBC presenter's latest bold outfit choice on live TV,https://www.thesun.co.uk/sport/24328590/alex-scott-bbc-outfit-jess-glynne/
32,,Watch Messi’s bodyguard as he tackles CHILD - but then gives him amazing moment,https://www.thesun.co.uk/sport/24328577/watch-messi-bodyguard-tackles-child-amazing-moment/
33,'TOP BLOKE',Ream's reaction to Basham injury praised as star suffers suspected broken ankle,https://www.thesun.co.uk/sport/24327062/tim-ream-chris-basham-injury/
34,GAB BLAST,Gabby Agbonlahor demands APOLOGY from ‘useless’ Man Utd for gesture,https://www.thesun.co.uk/sport/24328242/gabby-agbonlahor-demands-apology-man-utd-brentford/
35,LUT IT BE,Luton staff fly to South America in bid to seal £5m 'new Moises Caicedo' deal,https://www.thesun.co.uk/sport/24325948/luton-town-moises-caicedo-chelsea-oscar-zambrano/
36,ROUD HEALTH,Giroud goes IN GOAL for Milan & makes huge save as fans say 'better than Onana',https://www.thesun.co.uk/sport/24326021/olivier-giroud-goalkeeper-ac-milan-wonder-save/
37,SPURRED ON,Tottenham close in on Norwich goalkeeper Thompson as wonderkid rejects new deal,https://www.thesun.co.uk/sport/24328290/tottenham-transfer-norwich-dylan-thompson/
38,SUN SHINE,Sunderland ace Clarke in line for huge £15m Prem transfer a year after Spurs exit,https://www.thesun.co.uk/sport/24326255/jack-clarke-tottenham-sunderland-brentford-transfer/
39,FEEL THE BURN,Newcastle to make new bid for Blackburn wonderkid but face four-horse race,https://www.thesun.co.uk/sport/24325320/newcastle-transfer-news-blackburn-adam-wharton-premier-league/
40,HUGH BEAUTY,"West Ham target EFL wonderkid, 19, as they look to strengthen defensive options",https://www.thesun.co.uk/sport/24328078/west-ham-transfer-charlie-hughes/
41,MADD ABOUT HER,James Maddison's Wag shows off thong in cheeky see-through outfit,https://www.thesun.co.uk/sport/24324014/james-maddison-wag-kennedy-alexa-thong-tottenham/
42,YOU'RE WELCOME,All the best UK casino welcome bonuses for new players revealed,https://www.thesun.co.uk/betting/21097803/casino-welcome-bonus/
43,TOP OF THE SLOTS,Best payout slots for UK revealed - and where you can play them,https://www.thesun.co.uk/betting/22472603/top-payout-slots-uk/
44,QUICK BUCKS,Get cash quick as a flash with our guide to the best instant withdrawal casinos,https://www.thesun.co.uk/betting/21287535/fast-withdrawal-casinos/
45,'STUPIDITY',Tottenham's Yves Bissouma SENT OFF for 'stupidest thing ever' against Luton,https://www.thesun.co.uk/sport/24322109/luton-tottenham-yves-bissouma-red-card/
46,DEVIL'S BELIEF,Ex-Man Utd coach given huge release clause as Premier League clubs circle,https://www.thesun.co.uk/sport/24325370/man-utd-coach-release-clause-kieran-mckenna/
47,TRUE BLUE,Fans only just realising who Paul Merson supports - leaving Arsenal fans shocked,https://www.thesun.co.uk/sport/24328570/who-does-paul-merson-support-arsenal-chelsea/
48,,Ligue 1 clash suspended after goalkeeper is stunned by FIREWORK thrown by fans,https://www.thesun.co.uk/sport/24329406/ligue-1-montpellier-clermont-mory-diaw/
49,,Bend It Like Beckham lands sequel 21 years after Kiera Knightley hit film,https://www.thesun.co.uk/sport/24322030/bend-it-like-beckham-sequel-kiera-knightley/
50,'PERFECTION',Ex-Prem Wag dubbed ‘world’s most beautiful woman' stuns in skin-tight dress,https://www.thesun.co.uk/sport/24321274/viktoria-varga-wag-leather-dress-instagram-graziano-pelle-southampton/
51,CLASS ACT,West Ham keeper Alphonse Areola hailed as 'absolute hero' for mascot gesture,https://www.thesun.co.uk/sport/24330563/west-ham-alphonse-areola-hero-mascot-headphones/
52,CAS CLOSED,Man Utd's Player of the Month hooked vs Brentford as fans say 'he's done',https://www.thesun.co.uk/sport/24323365/man-utd-brentford-casemiro-mistake-substituted-ten-hag/
53,,Fulham clash stopped after horror injury for Sheff Utd star Chris Basham,https://www.thesun.co.uk/sport/24322961/chris-basham-horror-injury-leg-break/
54,BREACH FOR THE STARS,Who is Jules Breach and what football team does she support?,https://www.thesun.co.uk/sport/21954416/who-is-jules-breach-what-football-team-does-support/
55,MAN UTD NEWS,"Jadon Sancho set for Euro giants EXCLUSIVE, David Beckham's takeover hint",https://www.thesun.co.uk/sport/24159367/man-utd-news-live-jadon-sancho-transfer-exclusive/
56,ARSENAL NEWS,"Stunning Manchester City WIN reaction, Gunners 'monitor Neto', White updates",https://www.thesun.co.uk/sport/24268915/arsenal-news-live-gabriel-martinelli-man-city-reaction/
57,GUNNER LEAVE,Napoli 'target Arsenal striker' as one of three transfers to replace Osimhen,https://www.thesun.co.uk/sport/24327234/napoli-arsenal-transfer-victor-osimhen-gabriel-jesus/
58,WAT A PERFORMANCE,Ollie Watkins storms up Dream Team rankings after 25-point masterclass,https://www.thesun.co.uk/sport/football/dream-team/24226932/ollie-watkins-aston-villa-brighton-fantasy-football-points/
59,SAKA ATTACKER,Most transferred-out player Bukayo Saka now Dream Team's top performer,https://www.thesun.co.uk/sport/football/dream-team/24229834/bukayo-saka-erling-haaland-fantasy-football-points-injury/
60,FLYING EAGLES,Crystal Palace have a top-tier Dream Team asset in every position this season,https://www.thesun.co.uk/sport/football/dream-team/24232312/crystal-palace-fantasy-football-premier-league-andersen-johnstone/
61,WHITE NOISE,London ground bigger than Wembley hosted ex-Prem side before being demolished,https://www.thesun.co.uk/sport/24234708/white-city-stadium-qpr-demolished-wembley/
62,OOH LA LA,Laura Woods shares embrace with Prem legend and former I'm A Celeb heartthrob,https://www.thesun.co.uk/sport/24320708/laura-woods-david-ginola-newcastle-psg-champions-league-instagram/
63,MAGS HEAD,Harry Maguire completely changes fans' minds with role in win over Brentford,https://www.thesun.co.uk/sport/24324487/harry-maguire-manchester-united-assist-scott-mctominay/
64,,Watch Merson lose it with Mike Dean in 'box office' VAR clash on Soccer Saturday,https://www.thesun.co.uk/sport/24322119/paul-merson-mike-dean-clash-soccer-saturday-var/
65,PUT OFF,Keane pulled plug on Savage Sunderland signing after hearing his voicemail message,https://www.thesun.co.uk/sport/24321404/transfer-news-roy-keane-robbie-savage-sunderland/
66,PALMED OFF,Inside abandoned stadium turned into park with reminder of iconic past,https://www.thesun.co.uk/sport/24281656/abandoned-stadium-estadio-insular-las-palmas-world-cup/
67,,Shock as Barnsley coach bursts into flames on return from away game,https://www.thesun.co.uk/sport/24326066/barnsley-coach-fire-exeter-city/
68,,Real Madrid fans hail Bellingham with iconic song as he scores another two goals,https://www.thesun.co.uk/sport/24325508/jude-bellingham-real-madrid-fans-sing-beatles/
69,FIGHT CLUB,Funny moment West Brom fan tries to pick fight after Birmingham score but can't,https://www.thesun.co.uk/sport/24323343/hilarious-moment-birmingham-city-fan-fight/
70,DAN THE MAN,"Sheffield Wednesday set to name former Bayern Munich coach, 34, as new manager",https://www.thesun.co.uk/sport/24326860/sheffield-wednesday-to-name-bayern-munich-coach-manager/
71,TROY DEENEY,"Man Utd's Onana will never be consistent, he's either brilliant or disastrous",https://www.thesun.co.uk/sport/24318948/andre-onana-david-raya-aaron-ramsdale/
72,KARREN BRADY,"After Saka nicked Maddison celebration, this Wembley moment is my favourite",https://www.thesun.co.uk/sport/24211537/bukayo-saka-james-maddison-dart-celebration-karren-brady/
73,DAVE KIDD,Chelsea took £200m in Brighton assets but Blues win in EFL Cup would be an upset,https://www.thesun.co.uk/sport/24133512/chelsea-brighton-carabao-cup-dave-kidd/
74,AL ABOARD,Scott sets pulses racing in elegant outfit as fans say 'your beauty never fails',https://www.thesun.co.uk/sport/24313793/alex-scott-instagram-elegant-dress/
75,NEW LISHA LIFE,Lehmann stuns in fresh-faced look as fans say 'is this a different person?',https://www.thesun.co.uk/sport/24296659/alisha-lehmann-new-look-instagram-fans-aston-villa/
76,RU BEAUTY,Dele Alli's model ex Ruby Mae goes braless in see-through dress sending fans wild,https://www.thesun.co.uk/sport/24306241/dele-alli-ruby-mae-braless-dress-fans-react/
